{
  "openresult": "1.0",
  "title": "A measure declared for a round that was not held",
  "measures": [
    {
      "id": "time",
      "label": "Time",
      "kind": "duration",
      "unit": "s",
      "betterWhen": "lower"
    },
    {
      "id": "penalty",
      "label": "Penalty",
      "kind": "duration",
      "unit": "s",
      "betterWhen": "lower"
    }
  ],
  "participants": [
    {
      "id": "ana",
      "name": "Ana Rivas"
    },
    {
      "id": "bo",
      "name": "Bo Lindqvist"
    },
    {
      "id": "cai",
      "name": "Cai Ferreira"
    }
  ],
  "results": [
    {
      "participant": "ana",
      "values": {
        "time": 604.2
      }
    },
    {
      "participant": "bo",
      "values": {
        "time": 598.7
      }
    },
    {
      "participant": "cai",
      "values": {
        "time": 611.9
      }
    }
  ],
  "rankings": [
    {
      "id": "general",
      "label": "General",
      "sortBy": ["time"]
    }
  ]
}
